{
  "$schema": "./schemas/source-contract-bundle.schema.json",
  "formatVersion": 2,
  "provenance": "official-source-imported",
  "sources": {
    "asyncapi": {
      "sourceId": "perps_asyncapi",
      "url": "https://docs.kalshi.com/perps_asyncapi.yaml",
      "sha256": "e5cc0f026b8e306e917860b870e23c9152d0d782c33137d42698f051a9dbe824",
      "snapshot": "sources/perps/perps_asyncapi.yaml",
      "dialect": "3.0.0",
      "document": {
        "asyncapi": "3.0.0",
        "info": {
          "title": "Kalshi Perps WebSocket API",
          "version": "2.0.0",
          "description": "WebSocket API for receiving real-time market data notifications and updates on Kalshi perps markets.\n\nSupported channels:\n- `orderbook_delta`\n- `ticker`\n- `trade`\n- `fill`\n- `user_orders`\n- `order_group_updates`\n",
          "contact": {
            "name": "Kalshi Support",
            "url": "https://kalshi.com",
            "email": "support@kalshi.com"
          },
          "license": {
            "name": "Proprietary",
            "url": "https://kalshi.com/terms"
          },
          "tags": [
            {
              "name": "control-frames",
              "description": "WebSocket control frames for connection management"
            },
            {
              "name": "commands",
              "description": "Client-to-server command messages"
            },
            {
              "name": "responses",
              "description": "Server responses to commands"
            },
            {
              "name": "market-data",
              "description": "Real-time margin market data updates"
            },
            {
              "name": "private",
              "description": "Private/authenticated margin data channels"
            }
          ]
        },
        "servers": {
          "production": {
            "host": "external-api-margin-ws.kalshi.com",
            "pathname": "/trade-api/ws/v2/margin",
            "protocol": "wss",
            "description": "Production margin WebSocket server (encrypted connection only)",
            "security": [
              {
                "$ref": "#/components/securitySchemes/apiKey"
              }
            ]
          },
          "demo": {
            "host": "external-api-margin-ws.demo.kalshi.co",
            "pathname": "/trade-api/ws/v2/margin",
            "protocol": "wss",
            "description": "Demo margin WebSocket server (encrypted connection only)",
            "security": [
              {
                "$ref": "#/components/securitySchemes/apiKey"
              }
            ]
          }
        },
        "defaultContentType": "application/json",
        "channels": {
          "root": {
            "address": "/",
            "title": "WebSocket Connection",
            "description": "Main WebSocket connection endpoint.\nAuthentication is required during the WebSocket handshake.\n",
            "bindings": {
              "ws": {
                "method": "GET"
              }
            },
            "messages": {
              "subscribeCommand": {
                "$ref": "#/components/messages/subscribeCommand"
              },
              "unsubscribeCommand": {
                "$ref": "#/components/messages/unsubscribeCommand"
              },
              "updateSubscriptionCommand": {
                "$ref": "#/components/messages/updateSubscriptionCommand"
              },
              "updateSubscriptionDeleteCommand": {
                "$ref": "#/components/messages/updateSubscriptionDeleteCommand"
              },
              "updateSubscriptionSingleSidCommand": {
                "$ref": "#/components/messages/updateSubscriptionSingleSidCommand"
              },
              "listSubscriptionsCommand": {
                "$ref": "#/components/messages/listSubscriptionsCommand"
              },
              "subscribedResponse": {
                "$ref": "#/components/messages/subscribedResponse"
              },
              "unsubscribedResponse": {
                "$ref": "#/components/messages/unsubscribedResponse"
              },
              "okResponse": {
                "$ref": "#/components/messages/okResponse"
              },
              "listSubscriptionsResponse": {
                "$ref": "#/components/messages/listSubscriptionsResponse"
              },
              "errorResponse": {
                "$ref": "#/components/messages/errorResponse"
              }
            }
          },
          "control_frames": {
            "address": "/",
            "title": "Connection Keep-Alive",
            "description": "Kalshi sends Ping frames every 10 seconds with body `heartbeat`.\nClients should respond with Pong frames.\n",
            "messages": {
              "incomingPing": {
                "$ref": "#/components/messages/incomingPing"
              },
              "incomingPong": {
                "$ref": "#/components/messages/incomingPong"
              },
              "outgoingPing": {
                "$ref": "#/components/messages/outgoingPing"
              },
              "outgoingPong": {
                "$ref": "#/components/messages/outgoingPong"
              }
            }
          },
          "orderbook_delta": {
            "address": "orderbook_delta",
            "title": "Orderbook Updates",
            "description": "Real-time margin orderbook price-level changes.\n\nRequirements:\n- authenticated connection\n- market specification required via `market_ticker` or `market_tickers`\n- sends `orderbook_snapshot` first, then incremental `orderbook_delta` updates\n- supports `get_snapshot` on `update_subscription` to request a fresh snapshot without changing the subscription\n",
            "messages": {
              "orderbookSnapshot": {
                "$ref": "#/components/messages/orderbookSnapshot"
              },
              "orderbookDelta": {
                "$ref": "#/components/messages/orderbookDelta"
              }
            }
          },
          "ticker": {
            "address": "ticker",
            "title": "Market Ticker",
            "description": "Margin market updates are delivered on a single channel. `ticker` messages include\nprice, top-of-book size, volume, open-interest, and optional reference/mark prices.\n\nMessages are coalesced to at most one per market per second (latest value wins\nwithin the window).\n\nRequirements:\n- no additional channel-level auth beyond the authenticated WebSocket connection\n- market specification optional\n- supports `market_ticker`/`market_tickers`\n",
            "messages": {
              "ticker": {
                "$ref": "#/components/messages/ticker"
              }
            }
          },
          "trade": {
            "address": "trade",
            "title": "Public Trades",
            "description": "Public notifications for executed margin trades.\n\nRequirements:\n- no additional channel-level auth beyond the authenticated WebSocket connection\n- market specification optional via `market_ticker` or `market_tickers`\n",
            "messages": {
              "trade": {
                "$ref": "#/components/messages/trade"
              }
            }
          },
          "fill": {
            "address": "fill",
            "title": "User Fills",
            "description": "Private fill notifications for the authenticated user on the margin exchange.\n\nRequirements:\n- authenticated connection\n- market specification optional via `market_ticker` or `market_tickers`\n- supports `update_subscription` with `add_markets` and `delete_markets`\n",
            "messages": {
              "fill": {
                "$ref": "#/components/messages/fill"
              }
            }
          },
          "user_orders": {
            "address": "user_orders",
            "title": "User Orders",
            "description": "Private order created/updated notifications for the authenticated user on the margin exchange.\n\nRequirements:\n- authenticated connection\n- market specification optional via `market_tickers`\n- supports `update_subscription` with `add_markets` and `delete_markets`\n",
            "messages": {
              "userOrder": {
                "$ref": "#/components/messages/userOrder"
              }
            }
          },
          "order_group_updates": {
            "address": "order_group_updates",
            "title": "Order Group Updates",
            "description": "Real-time order group lifecycle and limit updates. Requires authentication.\n\n**Requirements:**\n- Authentication required\n- Market specification ignored\n- Updates sent when order groups are created, triggered, reset, deleted, or have limits updated\n\n**Use case:** Tracking order group lifecycle and limits\n",
            "messages": {
              "orderGroupUpdates": {
                "$ref": "#/components/messages/orderGroupUpdates"
              }
            }
          }
        },
        "operations": {
          "sendPing": {
            "action": "receive",
            "title": "Send Ping",
            "channel": {
              "$ref": "#/channels/control_frames"
            },
            "messages": [
              {
                "$ref": "#/channels/control_frames/messages/incomingPing"
              }
            ],
            "tags": [
              {
                "name": "control-frames"
              }
            ]
          },
          "sendPong": {
            "action": "receive",
            "title": "Send Pong",
            "channel": {
              "$ref": "#/channels/control_frames"
            },
            "messages": [
              {
                "$ref": "#/channels/control_frames/messages/incomingPong"
              }
            ],
            "tags": [
              {
                "name": "control-frames"
              }
            ]
          },
          "sendSubscribe": {
            "action": "receive",